[
  {
    "schemaVersion": "1.1.0",
    "exerciseId": "550e8400-e29b-41d4-a716-446655440001",
    "canonical": {
      "name": "3/4 Sit-Up",
      "slug": "three-quarter-sit-up",
      "description": "A partial sit-up variation that targets the rectus abdominis while reducing strain on the lower back. This beginner-friendly core exercise focuses on the upper portion of the abdominal contraction.",
      "aliases": ["three-quarter situp", "partial sit-up", "half sit-up"]
    },
    "classification": {
      "exerciseType": "strength",
      "movement": "core-anti-extension",
      "mechanics": "isolation",
      "force": "pull",
      "level": "beginner"
    },
    "targets": {
      "primary": [
        {
          "id": "c3d4e5f6-3333-4000-8000-000000000022",
          "name": "Rectus Abdominis",
          "slug": "rectus-abdominis",
          "categoryId": "a1b2c3d4-1111-4000-8000-000000000004"
        }
      ]
    },
    "equipment": {
      "required": [
        {
          "id": "b2c3d4e5-2222-4000-8000-000000000005",
          "name": "Body Weight",
          "slug": "body-weight"
        }
      ]
    },
    "metrics": {
      "primary": {
        "type": "reps",
        "unit": "count"
      }
    },
    "media": [
      {
        "type": "image",
        "uri": "file:///path/to/animations/0001.gif"
      }
    ],
    "metadata": {
      "createdAt": "2026-01-25T00:00:00Z",
      "updatedAt": "2026-01-25T00:00:00Z",
      "status": "draft",
      "source": "exercises-db-import",
      "externalRefs": [
        {
          "system": "legacy-exercises-db",
          "id": "0001"
        }
      ]
    }
  },
  {
    "schemaVersion": "1.1.0",
    "exerciseId": "550e8400-e29b-41d4-a716-446655440025",
    "canonical": {
      "name": "Barbell Bench Press",
      "slug": "barbell-bench-press",
      "description": "A fundamental compound pushing exercise that primarily targets the pectoralis major while engaging the anterior deltoids and triceps. The barbell bench press is essential for building upper body pushing strength and chest development.",
      "aliases": ["bench press", "flat bench press", "barbell press"]
    },
    "classification": {
      "exerciseType": "strength",
      "movement": "push-horizontal",
      "mechanics": "compound",
      "force": "push",
      "level": "intermediate"
    },
    "targets": {
      "primary": [
        {
          "id": "c3d4e5f6-3333-4000-8000-000000000020",
          "name": "Chest",
          "slug": "chest",
          "categoryId": "a1b2c3d4-1111-4000-8000-000000000003"
        }
      ],
      "secondary": [
        {
          "id": "c3d4e5f6-3333-4000-8000-000000000040",
          "name": "Anterior Deltoid",
          "slug": "anterior-deltoid",
          "categoryId": "a1b2c3d4-1111-4000-8000-000000000008"
        },
        {
          "id": "c3d4e5f6-3333-4000-8000-000000000003",
          "name": "Triceps",
          "slug": "triceps",
          "categoryId": "a1b2c3d4-1111-4000-8000-000000000001"
        }
      ]
    },
    "equipment": {
      "required": [
        {
          "id": "b2c3d4e5-2222-4000-8000-000000000003",
          "name": "Barbell",
          "slug": "barbell"
        }
      ],
      "optional": [
        {
          "id": "b2c3d4e5-2222-4000-8000-000000000031",
          "name": "Power Rack",
          "slug": "power-rack"
        }
      ]
    },
    "metrics": {
      "primary": {
        "type": "reps",
        "unit": "count"
      },
      "secondary": [
        {
          "type": "weight",
          "unit": "kg"
        }
      ]
    },
    "media": [
      {
        "type": "image",
        "uri": "file:///path/to/animations/0025.gif"
      }
    ],
    "metadata": {
      "createdAt": "2026-01-25T00:00:00Z",
      "updatedAt": "2026-01-25T00:00:00Z",
      "status": "draft",
      "source": "exercises-db-import",
      "externalRefs": [
        {
          "system": "legacy-exercises-db",
          "id": "0025"
        }
      ]
    }
  },
  {
    "schemaVersion": "1.1.0",
    "exerciseId": "550e8400-e29b-41d4-a716-446655440007",
    "canonical": {
      "name": "Alternate Lateral Pulldown",
      "slug": "alternate-lateral-pulldown",
      "description": "A unilateral cable exercise that targets the latissimus dorsi with alternating arm pulls. This variation allows for focused muscle engagement on each side, helping to address muscle imbalances while building back width.",
      "aliases": ["alternating lat pulldown", "single arm pulldown", "unilateral pulldown"]
    },
    "classification": {
      "exerciseType": "strength",
      "movement": "pull-vertical",
      "mechanics": "compound",
      "force": "pull",
      "level": "intermediate",
      "unilateral": true
    },
    "targets": {
      "primary": [
        {
          "id": "c3d4e5f6-3333-4000-8000-000000000015",
          "name": "Latissimus Dorsi",
          "slug": "latissimus-dorsi",
          "categoryId": "a1b2c3d4-1111-4000-8000-000000000002"
        }
      ],
      "secondary": [
        {
          "id": "c3d4e5f6-3333-4000-8000-000000000004",
          "name": "Biceps Brachii",
          "slug": "biceps-brachii",
          "categoryId": "a1b2c3d4-1111-4000-8000-000000000001"
        }
      ]
    },
    "equipment": {
      "required": [
        {
          "id": "b2c3d4e5-2222-4000-8000-000000000009",
          "name": "Cable Machine",
          "slug": "cable-machine"
        }
      ]
    },
    "metrics": {
      "primary": {
        "type": "reps",
        "unit": "count"
      },
      "secondary": [
        {
          "type": "weight",
          "unit": "kg"
        }
      ]
    },
    "media": [
      {
        "type": "image",
        "uri": "file:///path/to/animations/0007.gif"
      }
    ],
    "metadata": {
      "createdAt": "2026-01-25T00:00:00Z",
      "updatedAt": "2026-01-25T00:00:00Z",
      "status": "draft",
      "source": "exercises-db-import",
      "externalRefs": [
        {
          "system": "legacy-exercises-db",
          "id": "0007"
        }
      ]
    }
  }
]
